{
    "task_id":  "T-402",
    "loop_number":  1,
    "verdict":  "approved",
    "checks":  {
                   "code_actually_changed":  {
                                                 "result":  "pass",
                                                 "evidence":  "Four new files under internal/config/: config.go (41 lines), config_test.go, and two YAML fixtures, all non-empty."
                                             },
                   "feature_wired_into_flow":  {
                                                   "result":  "pass",
                                                   "evidence":  "Load(path string) (*Config, error) matches the exact signature already called from cmd/server/main.go. Called Load() directly against internal/config/testdata/sample-config.yaml in an ad hoc script and confirmed ListenAddr==\u0027:9090\u0027, LogLevel==\u0027debug\u0027."
                                               },
                   "tests_actually_executed":  {
                                                   "result":  "pass",
                                                   "evidence":  "Re-ran go test ./internal/config/... -v independently: 3 passed, matching the report."
                                               },
                   "test_results_match_report":  {
                                                     "result":  "pass",
                                                     "evidence":  "Independent re-run produced the same 3 passed / 0 failed as the implementation report."
                                                 },
                   "no_fake_or_placeholder_success":  {
                                                          "result":  "pass",
                                                          "evidence":  "Read config.go in full: Load() performs a real os.Stat check, real yaml.Unmarshal over file bytes, and returns a genuinely wrapped error on parse failure; no hardcoded return values."
                                                      },
                   "no_regressions":  {
                                          "result":  "not_applicable",
                                          "evidence":  "New package; nothing pre-existing to regress."
                                      },
                   "interfaces_preserved":  {
                                                "result":  "pass",
                                                "evidence":  "Load(path string) (*Config, error) matches the signature main.go already calls, confirmed by reading cmd/server/main.go."
                                            },
                   "no_out_of_scope_changes":  {
                                                   "result":  "pass",
                                                   "evidence":  "Only files under internal/config/, all within editable_files (including the added malformed.yaml fixture, which is listed there); cmd/server/main.go and internal/health/* untouched."
                                               },
                   "error_handling_present":  {
                                                  "result":  "pass",
                                                  "evidence":  "TestLoad_MissingFile_ReturnsDefaults and TestLoad_MalformedYaml_ReturnsError both pass, covering both required error-handling branches."
                                              },
                   "completion_criteria_met":  {
                                                   "result":  "pass",
                                                   "evidence":  "All four completion_criteria_status entries are met:true, independently reproduced via direct Load() calls and the go test re-run."
                                               }
               },
    "notes":  "Reviewed independently of T-401; this task\u0027s completion does not depend on the health endpoint landing.",
    "review_context":  "director_review_of_worker_output"
}
