{
    "task_id":  "T-401",
    "loop_number":  1,
    "verdict":  "approved",
    "checks":  {
                   "code_actually_changed":  {
                                                 "result":  "pass",
                                                 "evidence":  "Two new files under internal/health/, both non-empty and containing real logic (handler.go: 28 lines)."
                                             },
                   "feature_wired_into_flow":  {
                                                   "result":  "pass",
                                                   "evidence":  "RegisterRoutes(mux) matches the exact signature already called from cmd/server/main.go. Built a standalone test binary importing internal/health and calling RegisterRoutes against an httptest.Server, then curled GET /health and received the expected JSON body."
                                               },
                   "tests_actually_executed":  {
                                                   "result":  "pass",
                                                   "evidence":  "Re-ran go test ./internal/health/... -v independently: 2 passed, matching the report."
                                               },
                   "test_results_match_report":  {
                                                     "result":  "pass",
                                                     "evidence":  "Independent re-run produced the same 2 passed / 0 failed as the implementation report."
                                                 },
                   "no_fake_or_placeholder_success":  {
                                                          "result":  "pass",
                                                          "evidence":  "Read handler.go in full: the GET branch writes a real JSON-encoded response and the non-GET branch calls http.Error with 405; no hardcoded test-only behavior."
                                                      },
                   "no_regressions":  {
                                          "result":  "not_applicable",
                                          "evidence":  "New package; nothing pre-existing to regress."
                                      },
                   "interfaces_preserved":  {
                                                "result":  "pass",
                                                "evidence":  "RegisterRoutes(mux *http.ServeMux) matches the signature main.go already calls, confirmed by reading cmd/server/main.go."
                                            },
                   "no_out_of_scope_changes":  {
                                                   "result":  "pass",
                                                   "evidence":  "Only internal/health/handler.go and internal/health/handler_test.go were touched, both within editable_files; cmd/server/main.go and internal/config/* untouched."
                                               },
                   "error_handling_present":  {
                                                  "result":  "pass",
                                                  "evidence":  "TestHealth_Post_ReturnsMethodNotAllowed passes, confirming the 405 path required by error_handling."
                                              },
                   "completion_criteria_met":  {
                                                   "result":  "pass",
                                                   "evidence":  "All three completion_criteria_status entries are met:true, independently reproduced via the standalone httptest run and the go test re-run."
                                               }
               },
    "notes":  "Reviewed independently of T-402; this task\u0027s completion does not depend on the config loader landing.",
    "review_context":  "director_review_of_worker_output"
}
